{
  "$schema": "./environment.schema.json",
  "schemaVersion": 1,
  "environment": "test",
  "region": "Sweden Central",
  "dataClassification": "SYNTHETIC_OR_APPROVED_TEST",
  "syntheticOnly": false,
  "tenantId": "00000000-0000-0000-0000-000000000000",
  "subscriptionId": "00000000-0000-0000-0000-000000000000",
  "capacity": {
    "name": "cap-novasteel-test-sc",
    "resourceGroupName": "rg-ns-test-fabric",
    "fabricCapacityId": "00000000-0000-0000-0000-000000000000",
    "armResourceId": "/subscriptions/00000000-0000-0000-0000-000000000000/resourceGroups/rg-ns-test-fabric/providers/Microsoft.Fabric/capacities/cap-novasteel-test-sc",
    "sku": "F2"
  },
  "authentication": { "mode": "AzureCli", "managedIdentityClientId": "" },
  "workspaces": {
    "rtiIngress": { "displayName": "NS-test-RTI-Ingress", "id": "" },
    "dataCore": { "displayName": "NS-test-DataCore", "id": "" },
    "ml": { "displayName": "NS-test-ML", "id": "" },
    "analytics": { "displayName": "NS-test-Analytics", "id": "" }
  },
  "items": {
    "eventhouseOperations": { "displayName": "evh-ns-operations", "id": "" },
    "kqlOperations": { "displayName": "kql-ns-operations", "id": "" },
    "landingLakehouse": { "displayName": "lh-ns-landing", "id": "" },
    "coreLakehouse": { "displayName": "lh-ns-core", "id": "" },
    "eventstreamTelemetry": { "displayName": "es-ns-telemetry-v1", "id": "" },
    "semanticOperations": { "displayName": "sm-ns-operations", "id": "" }
  },
  "onelake": {
    "landingTablesUri": "abfss://<rti-workspace-guid>@onelake.dfs.fabric.microsoft.com/<landing-lakehouse-guid>/Tables",
    "coreTablesUri": "abfss://<datacore-workspace-guid>@onelake.dfs.fabric.microsoft.com/<core-lakehouse-guid>/Tables"
  },
  "retention": {
    "telemetryHot": "30d",
    "alarmHot": "90d",
    "gatewayHealthHot": "14d",
    "modelInferenceHot": "30d",
    "quarantineHot": "14d"
  },
  "bindings": {
    "eventstreamPublisherObjectId": "",
    "dataEngineeringIdentityObjectId": "",
    "sensitivityLabelId": "",
    "kqlQueryServiceUri": "",
    "kqlIngestionServiceUri": "",
    "coreSqlEndpoint": "",
    "connections": { "mes": "", "lims": "", "cmms": "", "market": "", "powerBi": "" }
  },
  "deploymentOptions": {
    "createWorkspaces": true,
    "assignCapacity": true,
    "deployRti": true,
    "deployLakehouses": true,
    "deployNotebooks": true,
    "deployPipelines": true,
    "deploySemanticModel": false,
    "semanticModelBindingValidated": false,
    "applyIngressPublisherAclWithFabricCli": false,
    "runInitializationJobs": false
  },
  "lifecycle": {
    "automationEnabled": true,
    "timeZone": "Europe/Luxembourg",
    "dailyCheckLocalTime": "01:00",
    "policyVersion": "novasteel-capacity-lifecycle/1.0",
    "preconditionMaxAgeMinutes": 10
  }
}
